[
  {
    "timestamp": "2025-08-10T00:55:17.966011+00:00",
    "pillar": "delivery",
    "name": "deployment_frequency",
    "value": 5,
    "target": 5,
    "unit": "deploys/7d",
    "status": "ok",
    "window": "7d"
  },
  {
    "timestamp": "2025-08-10T00:55:17.966011+00:00",
    "pillar": "delivery",
    "name": "lead_time_for_changes",
    "value": 14,
    "target": 24,
    "unit": "h",
    "status": "ok",
    "window": "7d"
  },
  {
    "timestamp": "2025-08-10T00:55:17.966011+00:00",
    "pillar": "delivery",
    "name": "change_failure_rate",
    "value": 8,
    "target": 15,
    "unit": "%",
    "status": "ok",
    "window": "30d"
  },
  {
    "timestamp": "2025-08-10T00:55:17.966011+00:00",
    "pillar": "delivery",
    "name": "mttr",
    "value": 2.6,
    "target": 4,
    "unit": "h",
    "status": "ok",
    "window": "30d"
  },
  {
    "timestamp": "2025-08-10T00:55:17.966011+00:00",
    "pillar": "quality",
    "name": "unit_test_coverage",
    "value": 82,
    "target": 80,
    "unit": "%",
    "status": "ok",
    "window": "7d"
  },
  {
    "timestamp": "2025-08-10T00:55:17.966011+00:00",
    "pillar": "quality",
    "name": "lint_errors",
    "value": 3,
    "target": 5,
    "unit": "count",
    "status": "ok",
    "window": "24h"
  },
  {
    "timestamp": "2025-08-10T00:55:17.966011+00:00",
    "pillar": "quality",
    "name": "schema_validation_pass_rate",
    "value": 98,
    "target": 95,
    "unit": "%",
    "status": "ok",
    "window": "24h"
  },
  {
    "timestamp": "2025-08-10T00:55:17.966011+00:00",
    "pillar": "security",
    "name": "critical_vulns_open",
    "value": 0,
    "target": 0,
    "unit": "count",
    "status": "ok",
    "window": "24h"
  },
  {
    "timestamp": "2025-08-10T00:55:17.966011+00:00",
    "pillar": "security",
    "name": "high_vulns_open",
    "value": 1,
    "target": 3,
    "unit": "count",
    "status": "ok",
    "window": "24h"
  },
  {
    "timestamp": "2025-08-10T00:55:17.966011+00:00",
    "pillar": "security",
    "name": "secrets_exposed",
    "value": 1,
    "target": 0,
    "unit": "count",
    "status": "fail",
    "window": "24h"
  },
  {
    "timestamp": "2025-08-10T00:55:17.966011+00:00",
    "pillar": "operations",
    "name": "staging_uptime",
    "value": 99.4,
    "target": 99.0,
    "unit": "%",
    "status": "ok",
    "window": "24h"
  },
  {
    "timestamp": "2025-08-10T00:55:17.966011+00:00",
    "pillar": "operations",
    "name": "error_rate_backend",
    "value": 0.3,
    "target": 1.0,
    "unit": "%",
    "status": "ok",
    "window": "24h"
  }
]